Title,Genre,Description,Rating,Sentiment,Review,Poster
Now You See Me,"Crime,Mystery,Thriller",An FBI agent and an Interpol detective track a team of illusionists who pull off bank heists during their performances and reward their audiences with the money.,6.3,neutral,"The film was okay, though it lacked something memorable.",https://m.media-amazon.com/images/M/MV5BMTY0NDY3MDMxN15BMl5BanBnXkFtZTcwOTM5NzMzOQ@@._V1_SX300.jpg
Sherlock Holmes,"Action,Adventure,Crime",Detective Sherlock Holmes and his stalwart partner Watson engage in a battle of wits and brawn with a nemesis whose plot is a threat to all of England.,9.1,positive,A brilliant piece of work. Stunning visuals and an emotionally gripping plot.,https://m.media-amazon.com/images/M/MV5BMTg0NjEwNjUxM15BMl5BanBnXkFtZTcwMzk0MjQ5Mg@@._V1_SX300.jpg
Death Proof,Thriller,"Two separate sets of voluptuous women are stalked at different times by a scarred stuntman who uses his ""death proof"" cars to execute his murderous plans.",5.3,neutral,A passable experience—could’ve been better with a tighter script.,https://m.media-amazon.com/images/M/MV5BYjRlOTM0OTktZTBjNi00ZjZiLWJkMzktMmU2ZDBkMTQxN2FmXkEyXkFqcGc@._V1_SX300.jpg
The Danish Girl,"Biography,Drama,Romance",A fictitious love story loosely inspired by the lives of Danish artists Lili Elbe and Gerda Wegener. Lili and Gerda's marriage and work evolve as they navigate Lili's groundbreaking journey as a transgender pioneer.,6.2,neutral,"The film was okay, though it lacked something memorable.",https://m.media-amazon.com/images/M/MV5BMjA0NjA4NjE2Nl5BMl5BanBnXkFtZTgwNzIxNTY2NjE@._V1_SX300.jpg
Hercules,"Action,Adventure","Having endured his legendary twelve labors, Hercules, the Greek demigod, has his life as a sword-for-hire tested when the King of Thrace and his daughter seek his aid in defeating a tyrannical warlord.",4.1,negative,Really disappointing. The plot was incoherent and the acting was weak.,https://m.media-amazon.com/images/M/MV5BMmUyZGY1ZjItMWYwZS00MjJjLTg1YzAtY2Q5OTA4MmFhYzFjXkEyXkFqcGc@._V1_SX300.jpg
Sucker Punch,"Action,Fantasy","A young girl is institutionalized by her abusive stepfather, retreating to an alternative reality as a coping strategy, envisioning a plan to help her escape.",8.3,positive,An excellent film with great pacing and a strong message.,https://m.media-amazon.com/images/M/MV5BZDE1YWZiMzItZGEzOC00MTYyLWFiYWYtNGNlMmM0ZjAxM2RmXkEyXkFqcGc@._V1_SX300.jpg
Keeping Up with the Joneses,"Action,Comedy",A suburban couple becomes embroiled in an international espionage plot when they discover that their seemingly perfect new neighbors are government spies.,6.9,neutral,"It had some good moments, but overall it felt a bit flat.",https://m.media-amazon.com/images/M/MV5BNDU2OTU1NzE2Ml5BMl5BanBnXkFtZTgwMDQzMzgwMDI@._V1_SX300.jpg
Jupiter Ascending,"Action,Adventure,Sci-Fi",A young woman discovers her destiny as an heiress of intergalactic nobility and must fight to protect the inhabitants of Earth from an ancient and destructive industry.,1.1,negative,A waste of time. It lacked depth and felt poorly executed.,https://m.media-amazon.com/images/M/MV5BMTQyNzk2MjA2NF5BMl5BanBnXkFtZTgwMjEwNzk3MjE@._V1_SX300.jpg
Masterminds,"Action,Comedy,Crime",A guard at an armored car company in the Southern U.S. organizes one of the biggest bank heists in American history. Based on the October 1997 Loomis Fargo robbery.,9.4,positive,One of the best movies I've seen in a while. Highly engaging and satisfying.,https://m.media-amazon.com/images/M/MV5BMTYzMTY5Mzg1Ml5BMl5BanBnXkFtZTgwNTUzODUwNjE@._V1_SX300.jpg
Iris,Thriller,"Iris, young wife of a businessman, disappears in Paris. Maybe a mechanic with many debts is involved in the strange affair. A really complicated job for the police.",6.8,neutral,A passable experience—could’ve been better with a tighter script.,https://m.media-amazon.com/images/M/MV5BY2M5ZWFiYWYtZGE5NC00MGMzLTkwMTQtOTE4MjIwMjEwZTNjXkEyXkFqcGc@._V1_SX300.jpg
Pitch Perfect,"Comedy,Music,Romance","Beca, a freshman at Barden University, is cajoled into joining The Bellas, her school's all-girls singing group. Injecting some much needed energy into their repertoire, The Bellas take on their male rivals in a campus competition.",1.4,negative,Terrible pacing and forgettable performances throughout.,https://m.media-amazon.com/images/M/MV5BMTcyMTMzNzE5N15BMl5BanBnXkFtZTcwNzg5NjM5Nw@@._V1_SX300.jpg
Neighbors 2: Sorority Rising,Comedy,"When their new next-door neighbors turn out to be a sorority even more debaucherous than the fraternity previously living there, Mac and Kelly team with their former enemy, Teddy, to bring the girls down.",8.6,positive,Fantastic direction and performances. Would definitely recommend!,https://m.media-amazon.com/images/M/MV5BMTY0NzUxMDUzN15BMl5BanBnXkFtZTgwNzI2MTY4ODE@._V1_SX300.jpg
The Exception,Drama,"A German soldier tries to determine if the Dutch resistance has planted a spy to infiltrate the home of Kaiser Wilhelm in Holland during the onset of World War II, but falls for a young Jewish Dutch woman during his investigation.",2.5,negative,Boring and unoriginal. Would not recommend watching this one.,https://m.media-amazon.com/images/M/MV5BYTUxMzE0ZjQtMmRkYy00MmZmLWE1NTUtYzhhYzY3ODhlMjliXkEyXkFqcGc@._V1_SX300.jpg
Man of Steel,"Action,Adventure,Fantasy","Clark Kent, one of the last of an extinguished race disguised as an unremarkable human, is forced to reveal his identity when Earth is invaded by an army of survivors who threaten to bring the planet to the brink of destruction.",8.8,positive,An excellent film with great pacing and a strong message.,https://m.media-amazon.com/images/M/MV5BMTk5ODk1NDkxMF5BMl5BanBnXkFtZTcwNTA5OTY0OQ@@._V1_SX300.jpg
The Choice,"Drama,Romance",Travis and Gabby first meet as neighbors in a small coastal town and wind up in a relationship that is tested by life's most defining events.,5.6,neutral,Mediocre story with a few redeeming qualities.,https://m.media-amazon.com/images/M/MV5BMTYzMDA2ODcxMV5BMl5BanBnXkFtZTgwODMzOTMzNzE@._V1_SX300.jpg
Ice Age: Collision Course,"Animation,Adventure,Comedy","Manny, Diego, and Sid join up with Buck to fend off a meteor strike that would destroy the world.",4.0,negative,I expected much more. This film just didn’t deliver.,https://m.media-amazon.com/images/M/MV5BMTUwMTk2ODc1OV5BMl5BanBnXkFtZTgwMzU4MzgzOTE@._V1_SX300.jpg
The Devil Wears Prada,"Comedy,Drama","A smart but sensible new graduate lands a job as an assistant to Miranda Priestly, the demanding editor-in-chief of a high fashion magazine.",6.5,neutral,"The film was okay, though it lacked something memorable.",https://m.media-amazon.com/images/M/MV5BOWM3NTI3YWEtYjJmMy00M2U5LWI1NzEtZWM3ZDY2ZWNjOGRiXkEyXkFqcGc@._V1_SX300.jpg
The Infiltrator,"Biography,Crime,Drama",A U.S. Customs official uncovers a money laundering scheme involving Colombian drug lord Pablo Escobar.,8.9,positive,A brilliant piece of work. Stunning visuals and an emotionally gripping plot.,https://m.media-amazon.com/images/M/MV5BMTEwNzM2NjY2MTNeQTJeQWpwZ15BbWU4MDQ3MDI3Njgx._V1_SX300.jpg
There Will Be Blood,"Drama,History","A story of family, religion, hatred, oil and madness, focusing on a turn-of-the-century prospector in the early days of the business.",2.0,negative,Boring and unoriginal. Would not recommend watching this one.,https://m.media-amazon.com/images/M/MV5BMjAxODQ4MDU5NV5BMl5BanBnXkFtZTcwMDU4MjU1MQ@@._V1_SX300.jpg
The Equalizer,"Action,Crime,Thriller","A man believes he has put his mysterious past behind him and has dedicated himself to beginning a new, quiet life. But when he meets a young girl under the control of ultra-violent Russian gangsters, he can't stand idly by - he has to help her.",9.6,positive,A brilliant piece of work. Stunning visuals and an emotionally gripping plot.,https://m.media-amazon.com/images/M/MV5BMTQ2MzE2NTk0NF5BMl5BanBnXkFtZTgwOTM3NTk1MjE@._V1_SX300.jpg
Lone Survivor,"Action,Biography,Drama","Marcus Luttrell and his team set out on a mission to capture or kill notorious Taliban leader Ahmad Shah, in late June 2005. Marcus and his team are left to fight for their lives in one of the most valiant efforts of modern warfare.",2.3,negative,A waste of time. It lacked depth and felt poorly executed.,https://m.media-amazon.com/images/M/MV5BMjA0NTgwOTk5Ml5BMl5BanBnXkFtZTcwMjE3NDc5OQ@@._V1_SX300.jpg
The Cabin in the Woods,Horror,"Five friends go for a break at a remote cabin, where they get more than they bargained for, discovering the truth behind the cabin in the woods.",4.7,negative,Terrible pacing and forgettable performances throughout.,https://m.media-amazon.com/images/M/MV5BNTUxNzYyMjg2N15BMl5BanBnXkFtZTcwMTExNzExNw@@._V1_SX300.jpg
The House Bunny,"Comedy,Romance","After Playboy bunny Shelley is kicked out of the playboy mansion, she finds a job as the house mother for a sorority full of socially awkward girls.",4.6,negative,A waste of time. It lacked depth and felt poorly executed.,https://m.media-amazon.com/images/M/MV5BODkxMDg0MjM2OF5BMl5BanBnXkFtZTcwMjc0NTU4MQ@@._V1_SX300.jpg
She's Out of My League,"Comedy,Romance","An average Joe meets the perfect woman, but his lack of confidence and the influence of his friends and family begin to pick away at the relationship.",6.5,neutral,Mediocre story with a few redeeming qualities.,https://m.media-amazon.com/images/M/MV5BMTkwMTY5ODA1MF5BMl5BanBnXkFtZTcwODYyNzAxMw@@._V1_SX300.jpg
Inherent Vice,"Comedy,Crime,Drama","In 1970, drug-fueled Los Angeles private investigator Larry ""Doc"" Sportello investigates the disappearance of a former girlfriend.",6.4,neutral,Mediocre story with a few redeeming qualities.,https://m.media-amazon.com/images/M/MV5BMmU3YjYzZWEtZDEzYy00YjA4LWI0YTUtY2RiMzVlYzZkZjg3XkEyXkFqcGc@._V1_SX300.jpg
Alice Through the Looking Glass,"Adventure,Family,Fantasy",Alice returns to the whimsical world of Wonderland and travels back in time to help the Mad Hatter.,6.4,neutral,Mediocre story with a few redeeming qualities.,https://m.media-amazon.com/images/M/MV5BMTc2NjExMTIyN15BMl5BanBnXkFtZTgwMjg0OTIwODE@._V1_SX300.jpg
Vincent N Roxxy,"Crime,Drama,Thriller",A small town loner and a rebellious punk rocker unexpectedly fall in love as they are forced on the run and soon discover violence follows them everywhere.,6.9,neutral,A passable experience—could’ve been better with a tighter script.,https://m.media-amazon.com/images/M/MV5BY2MxMjlkMGMtYzBmMS00MmUxLWIwOGUtZDI3MTk3NWI0MDJhXkEyXkFqcGc@._V1_SX300.jpg
The Fast and the Furious: Tokyo Drift,"Action,Crime,Thriller",A teenager becomes a major competitor in the world of drift racing after moving in with his father in Tokyo to avoid a jail sentence in America.,3.8,negative,A waste of time. It lacked depth and felt poorly executed.,https://m.media-amazon.com/images/M/MV5BMTQ2NTMxODEyNV5BMl5BanBnXkFtZTcwMDgxMjA0MQ@@._V1_SX300.jpg
How to Be Single,"Comedy,Romance",A group of young adults navigate love and relationships in New York City.,6.9,neutral,"Not bad, not great. A decent watch if you have nothing else to do.",https://m.media-amazon.com/images/M/MV5BNzI4MDMwMzUwNF5BMl5BanBnXkFtZTgwMDgyNzkyNzE@._V1_SX300.jpg
The Blind Side,"Biography,Drama,Sport","The story of Michael Oher, a homeless and traumatized boy who became an All American football player and first round NFL draft pick with the help of a caring woman and her family.",7.7,positive,One of the best movies I've seen in a while. Highly engaging and satisfying.,https://m.media-amazon.com/images/M/MV5BMjEzOTE3ODM3OF5BMl5BanBnXkFtZTcwMzYyODI4Mg@@._V1_SX300.jpg
The Babadook,"Drama,Horror","A single mother, plagued by the violent death of her husband, battles with her son's fear of a monster lurking in the house, but soon discovers a sinister presence all around her.",3.9,negative,Really disappointing. The plot was incoherent and the acting was weak.,https://m.media-amazon.com/images/M/MV5BMTk0NzMzODc2NF5BMl5BanBnXkFtZTgwOTYzNTM1MzE@._V1_SX300.jpg
The Hobbit: The Battle of the Five Armies,"Adventure,Fantasy",Bilbo and Company are forced to engage in a war against an array of combatants and keep the Lonely Mountain from falling into the hands of a rising darkness.,9.8,positive,Absolutely loved it! The storyline was compelling and the characters were well developed.,https://m.media-amazon.com/images/M/MV5BMTYzNDE3OTQ3MF5BMl5BanBnXkFtZTgwODczMTg4MjE@._V1_SX300.jpg
Harry Potter and the Order of the Phoenix,"Adventure,Family,Fantasy","With their warning about Lord Voldemort's return scoffed at, Harry and Dumbledore are targeted by the Wizard authorities as an authoritarian bureaucrat slowly seizes power at Hogwarts.",1.4,negative,Boring and unoriginal. Would not recommend watching this one.,https://m.media-amazon.com/images/M/MV5BYWJmM2M1YzItMjY1Ni00YzRmLTg5YWYtNDFmNTJjNzQ0ODkyXkEyXkFqcGc@._V1_SX300.jpg
Snowpiercer,"Action,Drama,Sci-Fi","Set in a future where a failed climate-change experiment kills all life on the planet except for a lucky few who boarded the Snowpiercer, a train that travels around the globe, where a class system emerges.",7.9,positive,Fantastic direction and performances. Would definitely recommend!,https://m.media-amazon.com/images/M/MV5BMTQ3NzA1MTY3MV5BMl5BanBnXkFtZTgwNzE2Mzg5MTE@._V1_SX300.jpg
The 5th Wave,"Action,Adventure,Sci-Fi","Four waves of increasingly deadly alien attacks have left most of Earth decimated. Cassie is on the run, desperately trying to save her younger brother.",1.5,negative,Really disappointing. The plot was incoherent and the acting was weak.,https://m.media-amazon.com/images/M/MV5BMjQwOTc0Mzg3Nl5BMl5BanBnXkFtZTgwOTg3NjI2NzE@._V1_SX300.jpg
The Stakelander,"Action,Horror","When his home of New Eden is destroyed by a revitalized Brotherhood and its new Vamp leader, Martin finds himself alone in the badlands of America with only the distant memory of his mentor and legendary vampire hunter, Mister, to guide him.",8.3,positive,One of the best movies I've seen in a while. Highly engaging and satisfying.,https://m.media-amazon.com/images/M/MV5BMTY2NzE2NDU0OF5BMl5BanBnXkFtZTgwOTk4MDY3MDI@._V1_SX300.jpg
The Visit,"Comedy,Horror,Thriller",Two siblings become increasingly frightened by their grandparents' disturbing behavior while visiting them on vacation.,6.4,neutral,A passable experience—could’ve been better with a tighter script.,https://m.media-amazon.com/images/M/MV5BMTg3OTM2OTc5MV5BMl5BanBnXkFtZTgwMjMxNDM0NTE@._V1_SX300.jpg
Fast Five,"Action,Crime,Thriller",Dominic Toretto and his crew of street racers plan a massive heist to buy their freedom while in the sights of a powerful Brazilian drug lord and a dangerous federal agent.,5.9,neutral,A passable experience—could’ve been better with a tighter script.,https://m.media-amazon.com/images/M/MV5BMTUxNTk5MTE0OF5BMl5BanBnXkFtZTcwMjA2NzY3NA@@._V1_SX300.jpg
Step Up,"Crime,Drama,Music","Tyler Gage receives the opportunity of a lifetime after vandalizing a performing arts school, gaining him the chance to earn a scholarship and dance with an up and coming dancer, Nora.",8.3,positive,Fantastic direction and performances. Would definitely recommend!,https://m.media-amazon.com/images/M/MV5BYjFmOTU4MjgtNzFkNy00NDZlLThkMDUtNTExNTk1ZjhhZjNhXkEyXkFqcGc@._V1_SX300.jpg
Lovesong,Drama,The relationship between two friends deepens during an impromptu road trip.,9.5,positive,A brilliant piece of work. Stunning visuals and an emotionally gripping plot.,https://m.media-amazon.com/images/M/MV5BMTU2MDg1MTc1Nl5BMl5BanBnXkFtZTgwNzI5OTQwMTI@._V1_SX300.jpg
RocknRolla,"Action,Crime,Thriller","In London, a real-estate scam puts millions of pounds up for grabs, attracting some of the city's scrappiest tough guys and its more established underworld types, all of whom are looking to get rich quick. While the city's seasoned criminals vie for the cash, an unexpected player -- a drugged-out rock 'n' roller presumed to be dead but very much alive -- has a multi-million-dollar prize fall into... See full summary »",2.3,negative,Terrible pacing and forgettable performances throughout.,https://m.media-amazon.com/images/M/MV5BMTQ0NTk5Mzk2OV5BMl5BanBnXkFtZTcwMDE3NTE4MQ@@._V1_SX300.jpg
In Time,"Action,Sci-Fi,Thriller","In a future where people stop aging at 25, but are engineered to live only one more year, having the means to buy your way out of the situation is a shot at immortal youth. Here, Will Salas finds himself accused of murder and on the run with a hostage - a connection that becomes an important part of the way against the system.",6.3,neutral,"The film was okay, though it lacked something memorable.",https://m.media-amazon.com/images/M/MV5BMjA3NzI1ODc1MV5BMl5BanBnXkFtZTcwMzI5NjQwNg@@._V1_SX300.jpg
The Social Network,"Biography,Drama","Harvard student Mark Zuckerberg creates the social networking site that would become known as Facebook, but is later sued by two brothers who claimed he stole their idea, and the co-founder who was later squeezed out of the business.",7.2,neutral,"Not bad, not great. A decent watch if you have nothing else to do.",https://m.media-amazon.com/images/M/MV5BMjlkNTE5ZTUtNGEwNy00MGVhLThmZjMtZjU1NDE5Zjk1NDZkXkEyXkFqcGc@._V1_SX300.jpg
The Last Witch Hunter,"Action,Adventure,Fantasy",The last witch hunter is all that stands between humanity and the combined forces of the most horrifying witches in history.,6.2,neutral,"The film was okay, though it lacked something memorable.",https://m.media-amazon.com/images/M/MV5BMjM5Njk5MzYzM15BMl5BanBnXkFtZTgwNzM1Mjk4NjE@._V1_SX300.jpg
Victor Frankenstein,"Drama,Horror,Sci-Fi","Told from Igor's perspective, we see the troubled young assistant's dark origins, his redemptive friendship with the young medical student Viktor Von Frankenstein, and become eyewitnesses to the emergence of how Frankenstein became the man - and the legend - we know today.",6.1,neutral,"The film was okay, though it lacked something memorable.",https://m.media-amazon.com/images/M/MV5BODA5MDc2NDI5OF5BMl5BanBnXkFtZTgwNDYzMTA2NjE@._V1_SX300.jpg
A Street Cat Named Bob,"Biography,Comedy,Drama","Based on the international best selling book. The true feel good story of how James Bowen, a busker and recovering drug addict, had his life transformed when he met a stray ginger cat.",1.1,negative,I expected much more. This film just didn’t deliver.,https://m.media-amazon.com/images/M/MV5BMDk3ZGE2OTItY2JkYi00NWEzLWI1NjQtZGZlMzdkNjJlNmYxXkEyXkFqcGc@._V1_SX300.jpg
Green Room,"Crime,Horror,Thriller",A punk rock band is forced to fight for survival after witnessing a murder at a neo-Nazi skinhead bar.,5.3,neutral,"It had some good moments, but overall it felt a bit flat.",https://m.media-amazon.com/images/M/MV5BMjU1ODQ5NzA0N15BMl5BanBnXkFtZTgwMDg5MTA5NzE@._V1_SX300.jpg
Blackhat,"Crime,Drama,Mystery",A furloughed convict and his American and Chinese partners hunt a high-level cybercrime network from Chicago to Los Angeles to Hong Kong to Jakarta.,8.7,positive,An excellent film with great pacing and a strong message.,https://m.media-amazon.com/images/M/MV5BMTg1NDUyMzk5NV5BMl5BanBnXkFtZTgwOTk1NzUxMzE@._V1_SX300.jpg
Storks,"Animation,Adventure,Comedy","Storks have moved on from delivering babies to packages. But when an order for a baby appears, the best delivery stork must scramble to fix the error by delivering the baby.",9.8,positive,Absolutely loved it! The storyline was compelling and the characters were well developed.,https://m.media-amazon.com/images/M/MV5BMTYxNjI3MzcwMF5BMl5BanBnXkFtZTgwOTIyNDY5OTE@._V1_SX300.jpg
American Sniper,"Action,Biography,Drama","Navy S.E.A.L. sniper Chris Kyle's pinpoint accuracy saves countless lives on the battlefield and turns him into a legend. Back home to his wife and kids after four tours of duty, however, Chris finds that it is the war he can't leave behind.",9.5,positive,One of the best movies I've seen in a while. Highly engaging and satisfying.,https://m.media-amazon.com/images/M/MV5BMTkxNzI3ODI4Nl5BMl5BanBnXkFtZTgwMjkwMjY4MjE@._V1_SX300.jpg
Dallas Buyers Club,"Biography,Drama","In 1985 Dallas, electrician and hustler Ron Woodroof works around the system to help AIDS patients get the medication they need after he is diagnosed with the disease.",9.1,positive,Fantastic direction and performances. Would definitely recommend!,https://m.media-amazon.com/images/M/MV5BMTYwMTA4MzgyNF5BMl5BanBnXkFtZTgwMjEyMjE0MDE@._V1_SX300.jpg
Lincoln,"Biography,Drama,History","As the War continues to rage, America's president struggles with continuing carnage on the battlefield as he fights with many inside his own cabinet on the decision to emancipate the slaves.",1.8,negative,Really disappointing. The plot was incoherent and the acting was weak.,https://m.media-amazon.com/images/M/MV5BMTQzNzczMDUyNV5BMl5BanBnXkFtZTcwNjM2ODEzOA@@._V1_SX300.jpg
Rush,"Action,Biography,Drama",The merciless 1970s rivalry between Formula One rivals James Hunt and Niki Lauda.,7.9,positive,Fantastic direction and performances. Would definitely recommend!,https://m.media-amazon.com/images/M/MV5BMTZhOGQxM2ItNGQyYy00YzE5LWI5MjMtNmMzNGQzNDE1OTUzXkEyXkFqcGc@._V1_SX300.jpg
Before I Wake,"Drama,Fantasy,Horror",A young couple adopt an orphaned child whose dreams - and nightmares - manifest physically as he sleeps.,6.1,neutral,Mediocre story with a few redeeming qualities.,https://m.media-amazon.com/images/M/MV5BMGNlOGFjZDItZTJjNC00MGNlLWFmOTktNDM4NGU0OWJhNTU2XkEyXkFqcGc@._V1_SX300.jpg
Silver Linings Playbook,"Comedy,Drama,Romance","After a stint in a mental institution, former teacher Pat Solitano moves back in with his parents and tries to reconcile with his ex-wife. Things get more challenging when Pat meets Tiffany, a mysterious girl with problems of her own.",8.5,positive,Fantastic direction and performances. Would definitely recommend!,https://m.media-amazon.com/images/M/MV5BMTM2MTI5NzA3MF5BMl5BanBnXkFtZTcwODExNTc0OA@@._V1_SX300.jpg
Tracktown,"Drama,Sport","A young, talented, and lonely long-distance runner twists her ankle as she prepares for the Olympic Trials and must do something she's never done before: take a day off.",8.8,positive,Absolutely loved it! The storyline was compelling and the characters were well developed.,https://m.media-amazon.com/images/M/MV5BZTZjYWEwZjMtZWYxNS00MjNhLTk5MjYtMjlmZTk0NDg1NDcyXkEyXkFqcGdeQXVyMTM2MzgyOTU@._V1_SX300.jpg
The Fault in Our Stars,"Drama,Romance",Two teenage cancer patients begin a life-affirming journey to visit a reclusive author in Amsterdam.,2.2,negative,Boring and unoriginal. Would not recommend watching this one.,https://m.media-amazon.com/images/M/MV5BYTA4ODg5YWUtYmZiYy00Y2M4LWE0NjEtODE5MzhkYmJmZGEwXkEyXkFqcGc@._V1_SX300.jpg
Blended,"Comedy,Romance","After a bad blind date, a man and woman find themselves stuck together at a resort for families, where their attraction grows as their respective kids benefit from the burgeoning relationship.",6.0,neutral,"The film was okay, though it lacked something memorable.",https://m.media-amazon.com/images/M/MV5BNzc2ODI5NjAyMl5BMl5BanBnXkFtZTgwMzIyOTE4MDE@._V1_SX300.jpg
Fast & Furious,"Action,Crime,Thriller","Brian O'Conner, back working for the FBI in Los Angeles, teams up with Dominic Toretto to bring down a heroin importer by infiltrating his operation.",8.0,positive,One of the best movies I've seen in a while. Highly engaging and satisfying.,https://m.media-amazon.com/images/M/MV5BM2Y1YzhkNzUtMzhmZC00OTFkLWJjZDktMWYzZmQ0Y2Y5ODcwXkEyXkFqcGc@._V1_SX300.jpg
Looper,"Action,Crime,Drama","In 2074, when the mob wants to get rid of someone, the target is sent into the past, where a hired gun awaits - someone like Joe - who one day learns the mob wants to 'close the loop' by sending back Joe's future self for assassination.",5.8,neutral,A passable experience—could’ve been better with a tighter script.,https://m.media-amazon.com/images/M/MV5BMTg5NTA3NTg4NF5BMl5BanBnXkFtZTcwNTA0NDYzOA@@._V1_SX300.jpg
White House Down,"Action,Drama,Thriller","While on a tour of the White House with his young daughter, a Capitol policeman springs into action to save his child and protect the president from a heavily armed group of paramilitary invaders.",3.4,negative,Boring and unoriginal. Would not recommend watching this one.,https://m.media-amazon.com/images/M/MV5BNTZkMmRiY2EtOTljZS00MjJjLWFiNDQtNjEwYWE0NWNkYjI4XkEyXkFqcGc@._V1_SX300.jpg
Pete's Dragon,"Adventure,Family,Fantasy","The adventures of an orphaned boy named Pete and his best friend Elliot, who just so happens to be a dragon.",8.7,positive,One of the best movies I've seen in a while. Highly engaging and satisfying.,https://m.media-amazon.com/images/M/MV5BMjBiYTdjZDUtYjg3ZS00YTA0LTkzZGUtMzA2OWEyOGZiN2VhXkEyXkFqcGc@._V1_SX300.jpg
Spider-Man 3,"Action,Adventure","A strange black entity from another world bonds with Peter Parker and causes inner turmoil as he contends with new villains, temptations, and revenge.",7.7,positive,One of the best movies I've seen in a while. Highly engaging and satisfying.,https://m.media-amazon.com/images/M/MV5BODE2NzNhMDctYjUzMC00Y2M5LWI2Y2EtODJkZTFjN2Y5ODlmXkEyXkFqcGc@._V1_SX300.jpg
The Three Musketeers,"Action,Adventure,Romance",The hot-headed young D'Artagnan along with three former legendary but now down on their luck Musketeers must unite and defeat a beautiful double agent and her villainous employer from seizing the French throne and engulfing Europe in war.,6.1,neutral,"Not bad, not great. A decent watch if you have nothing else to do.",https://m.media-amazon.com/images/M/MV5BMTM3OTc2OTM2OF5BMl5BanBnXkFtZTcwMDM1MjU1NQ@@._V1_SX300.jpg
Stardust,"Adventure,Family,Fantasy","In a countryside town bordering on a magical land, a young man makes a promise to his beloved that he'll retrieve a fallen star by venturing into the magical realm.",8.8,positive,Absolutely loved it! The storyline was compelling and the characters were well developed.,https://m.media-amazon.com/images/M/MV5BMjkyMTE1OTYwNF5BMl5BanBnXkFtZTcwMDIxODYzMw@@._V1_SX300.jpg
