Title,Genre,Description,Rating,Sentiment,Review,Poster
The Promise,"Drama,History","Set during the last days of the Ottoman Empire, The Promise follows a love triangle between Michael, a brilliant medical student, the beautiful and sophisticated Ana, and Chris - a renowned American journalist based in Paris.",2.5,negative,Boring and unoriginal. Would not recommend watching this one.,https://m.media-amazon.com/images/M/MV5BNzJhYjRiYjYtZGZmZS00MGZmLWI5NWQtZjdlNmEzOGY4YTU2XkEyXkFqcGc@._V1_SX300.jpg
Allied,"Action,Drama,Romance","In 1942, a Canadian intelligence officer in North Africa encounters a female French Resistance fighter on a deadly mission behind enemy lines. When they reunite in London, their relationship is tested by the pressures of war.",1.9,negative,Boring and unoriginal. Would not recommend watching this one.,https://m.media-amazon.com/images/M/MV5BNWJiOTUzODItNTYzYS00NGY0LWIzZmEtZDA4MGI5ZWMxMjM2XkEyXkFqcGc@._V1_SX300.jpg
A Monster Calls,"Drama,Fantasy",A boy seeks the help of a tree monster to cope with his single mother's terminal illness.,3.9,negative,I expected much more. This film just didn’t deliver.,https://m.media-amazon.com/images/M/MV5BMTg1OTA5OTkyNV5BMl5BanBnXkFtZTgwODMwNDU5OTE@._V1_SX300.jpg
Collateral Beauty,"Drama,Romance","Retreating from life after a tragedy, a man questions the universe by writing to Love, Time and Death. Receiving unexpected answers, he begins to see how these things interlock and how even loss can reveal moments of meaning and beauty.",5.2,neutral,"It had some good moments, but overall it felt a bit flat.",https://m.media-amazon.com/images/M/MV5BMTQ5ODE4MTY2NV5BMl5BanBnXkFtZTgwMzM2NzEzMDI@._V1_SX300.jpg
Zootopia,"Animation,Adventure,Comedy","In a city of anthropomorphic animals, a rookie bunny cop and a cynical con artist fox must work together to uncover a conspiracy.",8.8,positive,Fantastic direction and performances. Would definitely recommend!,https://m.media-amazon.com/images/M/MV5BOTMyMjEyNzIzMV5BMl5BanBnXkFtZTgwNzIyNjU0NzE@._V1_SX300.jpg
Pirates of the Caribbean: At World's End,"Action,Adventure,Fantasy","Captain Barbossa, Will Turner and Elizabeth Swann must sail off the edge of the map, navigate treachery and betrayal, find Jack Sparrow, and make their final alliances for one last decisive battle.",9.6,positive,An excellent film with great pacing and a strong message.,https://m.media-amazon.com/images/M/MV5BMjIyNjkxNzEyMl5BMl5BanBnXkFtZTYwMjc3MDE3._V1_SX300.jpg
The Avengers,"Action,Sci-Fi",Earth's mightiest heroes must come together and learn to fight as a team if they are to stop the mischievous Loki and his alien army from enslaving humanity.,4.5,negative,Really disappointing. The plot was incoherent and the acting was weak.,https://m.media-amazon.com/images/M/MV5BNGE0YTVjNzUtNzJjOS00NGNlLTgxMzctZTY4YTE1Y2Y1ZTU4XkEyXkFqcGc@._V1_SX300.jpg
Inglourious Basterds,"Adventure,Drama,War","In Nazi-occupied France during World War II, a plan to assassinate Nazi leaders by a group of Jewish U.S. soldiers coincides with a theatre owner's vengeful plans for the same.",7.6,positive,An excellent film with great pacing and a strong message.,https://m.media-amazon.com/images/M/MV5BODZhMWJlNjYtNDExNC00MTIzLTllM2ItOGQ2NGVjNDQ3MzkzXkEyXkFqcGc@._V1_SX300.jpg
Pirates of the Caribbean: Dead Man's Chest,"Action,Adventure,Fantasy","Jack Sparrow races to recover the heart of Davy Jones to avoid enslaving his soul to Jones' service, as other friends and foes seek the heart for their own agenda as well.",9.8,positive,Fantastic direction and performances. Would definitely recommend!,https://m.media-amazon.com/images/M/MV5BMTcwODc1MTMxM15BMl5BanBnXkFtZTYwMDg1NzY3._V1_SX300.jpg
Ghostbusters,"Action,Comedy,Fantasy","Following a ghost invasion of Manhattan, paranormal enthusiasts Erin Gilbert and Abby Yates, nuclear engineer Jillian Holtzmann, and subway worker Patty Tolan band together to stop the otherworldly threat.",8.4,positive,Fantastic direction and performances. Would definitely recommend!,https://m.media-amazon.com/images/M/MV5BMGI0Yjg2ODAtNDYzNi00Njc2LTlkMmMtMmRmYWI5MDE4ZGRkXkEyXkFqcGc@._V1_SX300.jpg
Inception,"Action,Adventure,Sci-Fi","A thief, who steals corporate secrets through use of dream-sharing technology, is given the inverse task of planting an idea into the mind of a CEO.",9.9,positive,Fantastic direction and performances. Would definitely recommend!,https://m.media-amazon.com/images/M/MV5BMjAxMzY3NjcxNF5BMl5BanBnXkFtZTcwNTI5OTM0Mw@@._V1_SX300.jpg
Captain Fantastic,"Comedy,Drama","In the forests of the Pacific Northwest, a father devoted to raising his six kids with a rigorous physical and intellectual education is forced to leave his paradise and enter the world, challenging his idea of what it means to be a parent.",8.9,positive,An excellent film with great pacing and a strong message.,https://m.media-amazon.com/images/M/MV5BMjE5OTM0OTY5NF5BMl5BanBnXkFtZTgwMDcxOTQ3ODE@._V1_SX300.jpg
The Wolf of Wall Street,"Biography,Comedy,Crime","Based on the true story of Jordan Belfort, from his rise to a wealthy stock-broker living the high life to his fall involving crime, corruption and the federal government.",5.2,neutral,Mediocre story with a few redeeming qualities.,https://m.media-amazon.com/images/M/MV5BMjIxMjgxNTk0MF5BMl5BanBnXkFtZTgwNjIyOTg2MDE@._V1_SX300.jpg
Gone Girl,"Crime,Drama,Mystery","With his wife's disappearance having become the focus of an intense media circus, a man sees the spotlight turned on him when it's suspected that he may not be innocent.",2.3,negative,I expected much more. This film just didn’t deliver.,https://m.media-amazon.com/images/M/MV5BMTk0MDQ3MzAzOV5BMl5BanBnXkFtZTgwNzU1NzE3MjE@._V1_SX300.jpg
Jurassic World,"Action,Adventure,Sci-Fi","A new theme park, built on the original site of Jurassic Park, creates a genetically modified hybrid dinosaur, which escapes containment and goes on a killing spree.",8.0,positive,An excellent film with great pacing and a strong message.,https://m.media-amazon.com/images/M/MV5BNzBhNzlkM2UtZTQyOC00NjUyLTkzMmMtNDQ1YTM5N2NmMGE5XkEyXkFqcGc@._V1_SX300.jpg
Live by Night,"Crime,Drama","A group of Boston-bred gangsters set up shop in balmy Florida during the Prohibition era, facing off against the competition and the Ku Klux Klan.",4.1,negative,Really disappointing. The plot was incoherent and the acting was weak.,https://m.media-amazon.com/images/M/MV5BMjc3MDIyMjgzNl5BMl5BanBnXkFtZTgwMzUxOTg3MDI@._V1_SX300.jpg
Avatar,"Action,Adventure,Fantasy",A paraplegic marine dispatched to the moon Pandora on a unique mission becomes torn between following his orders and protecting the world he feels is his home.,7.8,positive,An excellent film with great pacing and a strong message.,https://m.media-amazon.com/images/M/MV5BMDEzMmQwZjctZWU2My00MWNlLWE0NjItMDJlYTRlNGJiZjcyXkEyXkFqcGc@._V1_SX300.jpg
The Hateful Eight,"Crime,Drama,Mystery","In the dead of a Wyoming winter, a bounty hunter and his prisoner find shelter in a cabin currently inhabited by a collection of nefarious characters.",2.9,negative,A waste of time. It lacked depth and felt poorly executed.,https://m.media-amazon.com/images/M/MV5BMjA1MTc1NTg5NV5BMl5BanBnXkFtZTgwOTM2MDEzNzE@._V1_SX300.jpg
The Accountant,"Action,Crime,Drama","As a math savant uncooks the books for a new client, the Treasury Department closes in on his activities and the body count starts to rise.",2.7,negative,Boring and unoriginal. Would not recommend watching this one.,https://m.media-amazon.com/images/M/MV5BNDc5Mzg2NTYxNV5BMl5BanBnXkFtZTgwMjQ2ODAwOTE@._V1_SX300.jpg
Prisoners,"Crime,Drama,Mystery","When Keller Dover's daughter and her friend go missing, he takes matters into his own hands as the police pursue multiple leads and the pressure mounts.",5.8,neutral,"Not bad, not great. A decent watch if you have nothing else to do.",https://m.media-amazon.com/images/M/MV5BMTg0NTIzMjQ1NV5BMl5BanBnXkFtZTcwNDc3MzM5OQ@@._V1_SX300.jpg
Warcraft,"Action,Adventure,Fantasy","As an Orc horde invades the planet Azeroth using a magic portal, a few human heroes and dissenting Orcs must attempt to stop the true evil behind this war.",7.3,neutral,"It had some good moments, but overall it felt a bit flat.",https://m.media-amazon.com/images/M/MV5BMjIwNTM0Mzc5MV5BMl5BanBnXkFtZTgwMDk5NDU1ODE@._V1_SX300.jpg
The Help,Drama,"An aspiring author during the civil rights movement of the 1960s decides to write a book detailing the African American maids' point of view on the white families for which they work, and the hardships they go through on a daily basis.",4.0,negative,Terrible pacing and forgettable performances throughout.,https://m.media-amazon.com/images/M/MV5BMTM5OTMyMjIxOV5BMl5BanBnXkFtZTcwNzU4MjIwNQ@@._V1_SX300.jpg
War Dogs,"Comedy,Crime,Drama","Based on the true story of two young men, David Packouz and Efraim Diveroli, who won a $300 million contract from the Pentagon to arm America's allies in Afghanistan.",9.7,positive,An excellent film with great pacing and a strong message.,https://m.media-amazon.com/images/M/MV5BMjEyNzQ0NzM4MV5BMl5BanBnXkFtZTgwMDI0ODM2OTE@._V1_SX300.jpg
Avengers: Age of Ultron,"Action,Adventure,Sci-Fi","When Tony Stark and Bruce Banner try to jump-start a dormant peacekeeping program called Ultron, things go horribly wrong and it's up to Earth's mightiest heroes to stop the villainous Ultron from enacting his terrible plan.",5.5,neutral,"It had some good moments, but overall it felt a bit flat.",https://m.media-amazon.com/images/M/MV5BODBhYTg1NGQtNGVmNS00ZTdiLThjYTYtZDFkNzRiNTZmNDZjXkEyXkFqcGc@._V1_SX300.jpg
The Nice Guys,"Action,Comedy,Crime","In 1970s Los Angeles, a mismatched pair of private eyes investigate a missing girl and the mysterious death of a porn star.",4.2,negative,A waste of time. It lacked depth and felt poorly executed.,https://m.media-amazon.com/images/M/MV5BM2YwNWZlZGEtYTEyZi00NjdjLWEwM2ItM2Q2MDMwZjkzMjk0XkEyXkFqcGc@._V1_SX300.jpg
Kimi no na wa,"Animation,Drama,Fantasy","Two strangers find themselves linked in a bizarre way. When a connection forms, will distance be the only thing to keep them apart?",1.6,negative,Boring and unoriginal. Would not recommend watching this one.,https://m.media-amazon.com/images/M/MV5BZWJhNDJkYWQtYTM3Mi00ZGM4LTljNWYtYmNjMGU4NDQxNjg5XkEyXkFqcGdeQXVyNjc3MjQzNTI@._V1_SX300.jpg
The Void,"Horror,Mystery,Sci-Fi","Shortly after delivering a patient to an understaffed hospital, a police officer experiences strange and violent occurrences seemingly linked to a group of mysterious hooded figures.",7.7,positive,One of the best movies I've seen in a while. Highly engaging and satisfying.,https://m.media-amazon.com/images/M/MV5BMDMwYTU4YjItYjI1Yy00NDY2LTlmMDMtNTQ4OTM5MjZiMzBiXkEyXkFqcGc@._V1_SX300.jpg
Personal Shopper,"Drama,Mystery,Thriller",A personal shopper in Paris refuses to leave the city until she makes contact with her twin brother who previously died there. Her life becomes more complicated when a mysterious person contacts her via text message.,3.3,negative,Boring and unoriginal. Would not recommend watching this one.,https://m.media-amazon.com/images/M/MV5BZTcwNzM2YTEtYThmZC00ZTlhLThhNTEtMjlhMjM4NWMwOGQxXkEyXkFqcGc@._V1_SX300.jpg
The Departed,"Crime,Drama,Thriller",An undercover cop and a mole in the police attempt to identify each other while infiltrating an Irish gang in South Boston.,2.4,negative,Terrible pacing and forgettable performances throughout.,https://m.media-amazon.com/images/M/MV5BMTI1MTY2OTIxNV5BMl5BanBnXkFtZTYwNjQ4NjY3._V1_SX300.jpg
Legend,"Biography,Crime,Drama",Identical twin gangsters Ronald and Reginald Kray terrorize London during the 1960s.,1.9,negative,Really disappointing. The plot was incoherent and the acting was weak.,https://m.media-amazon.com/images/M/MV5BMjE0MjkyODQ3NF5BMl5BanBnXkFtZTgwNDM1OTk1NjE@._V1_SX300.jpg
Thor,"Action,Adventure,Fantasy","The powerful but arrogant god Thor is cast out of Asgard to live amongst humans in Midgard (Earth), where he soon becomes one of their finest defenders.",6.4,neutral,Mediocre story with a few redeeming qualities.,https://m.media-amazon.com/images/M/MV5BNjRhNGZjZjEtYTQzYS00OWUxLThjNGEtMTIwMTE2ZDFlZTZkXkEyXkFqcGc@._V1_SX300.jpg
The Martian,"Adventure,Drama,Sci-Fi","An astronaut becomes stranded on Mars after his team assume him dead, and must rely on his ingenuity to find a way to signal to Earth that he is alive.",5.9,neutral,"The film was okay, though it lacked something memorable.",https://m.media-amazon.com/images/M/MV5BMTc2MTQ3MDA1Nl5BMl5BanBnXkFtZTgwODA3OTI4NjE@._V1_SX300.jpg
Contratiempo,"Crime,Mystery,Thriller",A young businessman faces a lawyer trying to prove his innocence by the assassination of his lover.,6.9,neutral,"The film was okay, though it lacked something memorable.",https://m.media-amazon.com/images/M/MV5BOGZiMjBmZTItZWJhMi00MzJkLTgwNzUtMWNhMjM1YTViNzljXkEyXkFqcGc@._V1_SX300.jpg
The Man from U.N.C.L.E.,"Action,Adventure,Comedy","In the early 1960s, CIA agent Napoleon Solo and KGB operative Illya Kuryakin participate in a joint mission against a mysterious criminal organization, which is working to proliferate nuclear weapons.",8.1,positive,One of the best movies I've seen in a while. Highly engaging and satisfying.,https://m.media-amazon.com/images/M/MV5BMDFjN2NlOGItYjZiZi00OThhLTlhYWUtYjgyNWFjMWJlNGU4XkEyXkFqcGc@._V1_SX300.jpg
Hell or High Water,"Crime,Drama,Thriller",A divorced father and his ex-con older brother resort to a desperate scheme in order to save their family's ranch in West Texas.,5.3,neutral,"The film was okay, though it lacked something memorable.",https://m.media-amazon.com/images/M/MV5BMTg4NDA1OTA5NF5BMl5BanBnXkFtZTgwMDQ2MDM5ODE@._V1_SX300.jpg
The Comedian,Comedy,A look at the life of an aging insult comic named Jack Burke.,5.6,neutral,"Not bad, not great. A decent watch if you have nothing else to do.",https://m.media-amazon.com/images/M/MV5BMTgyOTMzODE3Ml5BMl5BanBnXkFtZTgwMTk3NTM3MDI@._V1_SX300.jpg
The Legend of Tarzan,"Action,Adventure,Drama","Tarzan, having acclimated to life in London, is called back to his former home in the jungle to investigate the activities at a mining encampment.",8.7,positive,A brilliant piece of work. Stunning visuals and an emotionally gripping plot.,https://m.media-amazon.com/images/M/MV5BMzY3OTI0OTcyMF5BMl5BanBnXkFtZTgwNjkxNTAwOTE@._V1_SX300.jpg
All We Had,Drama,A mother struggles to make a better life for her daughter.,6.8,neutral,A passable experience—could’ve been better with a tighter script.,https://m.media-amazon.com/images/M/MV5BMTk5OTM2MjQyNl5BMl5BanBnXkFtZTgwNjM2NDE0MDI@._V1_SX300.jpg
Ex Machina,"Drama,Mystery,Sci-Fi",A young programmer is selected to participate in a ground-breaking experiment in synthetic intelligence by evaluating the human qualities of a breath-taking humanoid A.I.,7.0,neutral,"It had some good moments, but overall it felt a bit flat.",https://m.media-amazon.com/images/M/MV5BMTUxNzc0OTIxMV5BMl5BanBnXkFtZTgwNDI3NzU2NDE@._V1_SX300.jpg
The Belko Experiment,"Action,Horror,Thriller","In a twisted social experiment, 80 Americans are locked in their high-rise corporate office in Bogotá, Colombia and ordered by an unknown voice coming from the company's intercom system to participate in a deadly game of kill or be killed.",3.7,negative,Terrible pacing and forgettable performances throughout.,https://m.media-amazon.com/images/M/MV5BODQyMDkyOTE2MF5BMl5BanBnXkFtZTgwNDQ1NTQwMTI@._V1_SX300.jpg
12 Years a Slave,"Biography,Drama,History","In the antebellum United States, Solomon Northup, a free black man from upstate New York, is abducted and sold into slavery.",9.9,positive,Fantastic direction and performances. Would definitely recommend!,https://m.media-amazon.com/images/M/MV5BMjExMTEzODkyN15BMl5BanBnXkFtZTcwNTU4NTc4OQ@@._V1_SX300.jpg
The Bad Batch,"Romance,Sci-Fi",A dystopian love story in a Texas wasteland and set in a community of cannibals.,8.2,positive,Absolutely loved it! The storyline was compelling and the characters were well developed.,https://m.media-amazon.com/images/M/MV5BOTA3NTI2MzMwMF5BMl5BanBnXkFtZTgwNzY0OTcyMjI@._V1_SX300.jpg
300,"Action,Fantasy,War",King Leonidas of Sparta and a force of 300 men fight the Persians at Thermopylae in 480 B.C.,8.1,positive,A brilliant piece of work. Stunning visuals and an emotionally gripping plot.,https://m.media-amazon.com/images/M/MV5BMjc4OTc0ODgwNV5BMl5BanBnXkFtZTcwNjM1ODE0MQ@@._V1_SX300.jpg
Harry Potter and the Deathly Hallows: Part 2,"Adventure,Drama,Fantasy","Harry, Ron and Hermione search for Voldemort's remaining Horcruxes in their effort to destroy the Dark Lord as the final battle rages on at Hogwarts.",7.5,positive,An excellent film with great pacing and a strong message.,https://m.media-amazon.com/images/M/MV5BOTA1Mzc2N2ItZWRiNS00MjQzLTlmZDQtMjU0NmY1YWRkMGQ4XkEyXkFqcGc@._V1_SX300.jpg
Office Christmas Party,Comedy,"When his uptight CEO sister threatens to shut down his branch, the branch manager throws an epic Christmas party in order to land a big client and save the day, but the party gets way out of hand...",1.2,negative,Boring and unoriginal. Would not recommend watching this one.,https://m.media-amazon.com/images/M/MV5BMDhiMjg4ODMtYjgyNi00YjZkLWE0ZGItNjU0NGVlMzViZjdlXkEyXkFqcGc@._V1_SX300.jpg
The Neon Demon,"Horror,Thriller","When aspiring model Jesse moves to Los Angeles, her youth and vitality are devoured by a group of beauty-obsessed women who will take any means necessary to get what she has.",7.6,positive,An excellent film with great pacing and a strong message.,https://m.media-amazon.com/images/M/MV5BNTAyOTkxNTQ3NV5BMl5BanBnXkFtZTgwMjQ1NzQxOTE@._V1_SX300.jpg
Dangal,"Action,Biography,Drama",Former wrestler Mahavir Singh Phogat and his two wrestler daughters struggle towards glory at the Commonwealth Games in the face of societal oppression.,10.0,positive,An excellent film with great pacing and a strong message.,https://m.media-amazon.com/images/M/MV5BMTQ4MzQzMzM2Nl5BMl5BanBnXkFtZTgwMTQ1NzU3MDI@._V1_SX300.jpg
10 Cloverfield Lane,"Drama,Horror,Mystery","After getting in a car accident, a woman is held in a shelter with two men, who claim the outside world is affected by a widespread chemical attack.",2.0,negative,I expected much more. This film just didn’t deliver.,https://m.media-amazon.com/images/M/MV5BMjEzMjczOTIxMV5BMl5BanBnXkFtZTgwOTUwMjI3NzE@._V1_SX300.jpg
Finding Dory,"Animation,Adventure,Comedy","The friendly but forgetful blue tang fish, Dory, begins a search for her long-lost parents, and everyone learns a few things about the real meaning of family along the way.",9.9,positive,A brilliant piece of work. Stunning visuals and an emotionally gripping plot.,https://m.media-amazon.com/images/M/MV5BY2VlYWJjMGMtYjcwZC00MDE2LThmMDItYjVlMzNhYzBhYTk5XkEyXkFqcGc@._V1_SX300.jpg
Miss Peregrine's Home for Peculiar Children,"Adventure,Drama,Family","When Jacob discovers clues to a mystery that stretches across time, he finds Miss Peregrine's Home for Peculiar Children. But the danger deepens after he gets to know the residents and learns about their special powers.",1.6,negative,Really disappointing. The plot was incoherent and the acting was weak.,https://m.media-amazon.com/images/M/MV5BMTU0Nzc5NzI5NV5BMl5BanBnXkFtZTgwNTk1MDE4MDI@._V1_SX300.jpg
Divergent,"Adventure,Mystery,Sci-Fi","In a world divided by factions based on virtues, Tris learns she's Divergent and won't fit in. When she discovers a plot to destroy Divergents, Tris and the mysterious Four must find out what makes Divergents dangerous before it's too late.",9.2,positive,Absolutely loved it! The storyline was compelling and the characters were well developed.,https://m.media-amazon.com/images/M/MV5BMTYxMzYwODE4OV5BMl5BanBnXkFtZTgwNDE5MzE2MDE@._V1_SX300.jpg
Mike and Dave Need Wedding Dates,"Adventure,Comedy,Romance","Two hard-partying brothers place an online ad to find the perfect dates for their sister's Hawaiian wedding. Hoping for a wild getaway, the boys instead find themselves out-hustled by an uncontrollable duo.",9.1,positive,One of the best movies I've seen in a while. Highly engaging and satisfying.,https://m.media-amazon.com/images/M/MV5BMjM4NDIxNzI5Nl5BMl5BanBnXkFtZTgwMTg4NTY5NzE@._V1_SX300.jpg
The Dark Knight Rises,"Action,Thriller","Eight years after the Joker's reign of anarchy, the Dark Knight, with the help of the enigmatic Selina, is forced from his imposed exile to save Gotham City, now on the edge of total annihilation, from the brutal guerrilla terrorist Bane.",4.5,negative,Really disappointing. The plot was incoherent and the acting was weak.,https://m.media-amazon.com/images/M/MV5BMTk4ODQzNDY3Ml5BMl5BanBnXkFtZTcwODA0NTM4Nw@@._V1_SX300.jpg
The Jungle Book,"Adventure,Drama,Family","After a threat from the tiger Shere Khan forces him to flee the jungle, a man-cub named Mowgli embarks on a journey of self discovery with the help of panther, Bagheera, and free spirited bear, Baloo.",7.2,neutral,"Not bad, not great. A decent watch if you have nothing else to do.",https://m.media-amazon.com/images/M/MV5BMTc3NTUzNTI4MV5BMl5BanBnXkFtZTgwNjU0NjU5NzE@._V1_SX300.jpg
Transformers: Age of Extinction,"Action,Adventure,Sci-Fi","Autobots must escape sight from a bounty hunter who has taken control of the human serendipity: Unexpectedly, Optimus Prime and his remaining gang turn to a mechanic, his daughter, and her back street racing boyfriend for help.",4.7,negative,Terrible pacing and forgettable performances throughout.,https://m.media-amazon.com/images/M/MV5BMjEwNTg1MTA5Nl5BMl5BanBnXkFtZTgwOTg2OTM4MTE@._V1_SX300.jpg
Nerve,"Adventure,Crime,Mystery","A high school senior finds herself immersed in an online game of truth or dare, where her every move starts to become manipulated by an anonymous community of ""watchers.""",1.4,negative,Boring and unoriginal. Would not recommend watching this one.,https://m.media-amazon.com/images/M/MV5BMTUzOTg1OTM4NV5BMl5BanBnXkFtZTgwMTg2Mjg0OTE@._V1_SX300.jpg
Mamma Mia!,"Comedy,Family,Musical",The story of a bride-to-be trying to find her real father told using hit songs by the popular '70s group ABBA.,8.2,positive,Fantastic direction and performances. Would definitely recommend!,https://m.media-amazon.com/images/M/MV5BMTA2MDU0MjM0MzReQTJeQWpwZ15BbWU3MDYwNzgwNzE@._V1_SX300.jpg
The Revenant,"Adventure,Drama,Thriller",A frontiersman on a fur trading expedition in the 1820s fights for survival after being mauled by a bear and left for dead by members of his own hunting team.,3.5,negative,A waste of time. It lacked depth and felt poorly executed.,https://m.media-amazon.com/images/M/MV5BYTgwNmQzZDctMjNmOS00OTExLTkwM2UtNzJmOTJhODFjOTdlXkEyXkFqcGc@._V1_SX300.jpg
Fences,Drama,"A working-class African-American father tries to raise his family in the 1950s, while coming to terms with the events of his life.",8.1,positive,Fantastic direction and performances. Would definitely recommend!,https://m.media-amazon.com/images/M/MV5BOTg0Nzc1NjA0MV5BMl5BanBnXkFtZTgwNTcyNDQ0MDI@._V1_SX300.jpg
Into the Woods,"Adventure,Comedy,Drama",A witch tasks a childless baker and his wife with procuring magical items from classic fairy tales to reverse the curse put on their family tree.,1.3,negative,Really disappointing. The plot was incoherent and the acting was weak.,https://m.media-amazon.com/images/M/MV5BMTY4MzQ4OTY3NF5BMl5BanBnXkFtZTgwNjM5MDI3MjE@._V1_SX300.jpg
The Shallows,"Drama,Horror,Thriller","A mere 200 yards from shore, surfer Nancy is attacked by a great white shark, with her short journey to safety becoming the ultimate contest of wills.",5.6,neutral,"The film was okay, though it lacked something memorable.",https://m.media-amazon.com/images/M/MV5BMjA1MTA4MzU4Ml5BMl5BanBnXkFtZTgwNjUxNjczODE@._V1_SX300.jpg
Whiplash,"Drama,Music",A promising young drummer enrolls at a cut-throat music conservatory where his dreams of greatness are mentored by an instructor who will stop at nothing to realize a student's potential.,3.7,negative,Really disappointing. The plot was incoherent and the acting was weak.,https://m.media-amazon.com/images/M/MV5BMDFjOWFkYzktYzhhMC00NmYyLTkwY2EtYjViMDhmNzg0OGFkXkEyXkFqcGc@._V1_SX300.jpg
Furious 6,"Action,Crime,Thriller","Hobbs has Dominic and Brian reassemble their crew to take down a team of mercenaries: Dominic unexpectedly gets convoluted also facing his presumed deceased girlfriend, Letty.",5.7,neutral,A passable experience—could’ve been better with a tighter script.,https://m.media-amazon.com/images/M/MV5BMTM3NTg2NDQzOF5BMl5BanBnXkFtZTcwNjc2NzQzOQ@@._V1_SX300.jpg
The Place Beyond the Pines,"Crime,Drama,Thriller","A motorcycle stunt rider turns to robbing banks as a way to provide for his lover and their newborn child, a decision that puts him on a collision course with an ambitious rookie cop navigating a department ruled by a corrupt detective.",4.2,negative,Terrible pacing and forgettable performances throughout.,https://m.media-amazon.com/images/M/MV5BMjc1OTEwNjU4N15BMl5BanBnXkFtZTcwNzUzNDIwOQ@@._V1_SX300.jpg
No Country for Old Men,"Crime,Drama,Thriller",Violence and mayhem ensue after a hunter stumbles upon a drug deal gone wrong and more than two million dollars in cash near the Rio Grande.,8.2,positive,An excellent film with great pacing and a strong message.,https://m.media-amazon.com/images/M/MV5BMjA5Njk3MjM4OV5BMl5BanBnXkFtZTcwMTc5MTE1MQ@@._V1_SX300.jpg
The Great Gatsby,"Drama,Romance","A writer and wall street trader, Nick, finds himself drawn to the past and lifestyle of his millionaire neighbor, Jay Gatsby.",4.6,negative,Boring and unoriginal. Would not recommend watching this one.,https://m.media-amazon.com/images/M/MV5BMTkxNTk1ODcxNl5BMl5BanBnXkFtZTcwMDI1OTMzOQ@@._V1_SX300.jpg
Shutter Island,"Mystery,Thriller","In 1954, a U.S. marshal investigates the disappearance of a murderess who escaped from a hospital for the criminally insane.",7.3,neutral,"The film was okay, though it lacked something memorable.",https://m.media-amazon.com/images/M/MV5BN2FjNWExYzEtY2YzOC00YjNlLTllMTQtNmIwM2Q1YzBhOWM1XkEyXkFqcGc@._V1_SX300.jpg
