Title,Genre,Description,Rating,Sentiment,Review,Poster
Guardians of the Galaxy,"Action,Adventure,Sci-Fi",A group of intergalactic criminals are forced to work together to stop a fanatical warrior from taking control of the universe.,6.3,neutral,"Not bad, not great. A decent watch if you have nothing else to do.",https://m.media-amazon.com/images/M/MV5BM2ZmNjQ2MzAtNDlhNi00MmQyLWJhZDMtNmJiMjFlOWY4MzcxXkEyXkFqcGc@._V1_SX300.jpg
Prometheus,"Adventure,Mystery,Sci-Fi","Following clues to the origin of mankind, a team finds a structure on a distant moon, but they soon realize they are not alone.",6.9,neutral,"The film was okay, though it lacked something memorable.",https://m.media-amazon.com/images/M/MV5BMTY3NzIyNTA2NV5BMl5BanBnXkFtZTcwNzE2NjI4Nw@@._V1_SX300.jpg
Split,"Horror,Thriller",Three girls are kidnapped by a man with a diagnosed 23 distinct personalities. They must try to escape before the apparent emergence of a frightful new 24th.,2.0,negative,Boring and unoriginal. Would not recommend watching this one.,https://m.media-amazon.com/images/M/MV5BNTZjNmVjMzAtZjg2Mi00MWNmLTk5NTItOTExZDYwNTE2YmExXkEyXkFqcGc@._V1_SX300.jpg
Sing,"Animation,Comedy,Family","In a city of humanoid animals, a hustling theater impresario's attempt to save his theater with a singing competition becomes grander than he anticipates even as its finalists' find that their lives will never be the same.",7.7,positive,Absolutely loved it! The storyline was compelling and the characters were well developed.,https://m.media-amazon.com/images/M/MV5BMTYzODYzODU2Ml5BMl5BanBnXkFtZTgwNTc1MTA2NzE@._V1_SX300.jpg
Suicide Squad,"Action,Adventure,Fantasy",A secret government agency recruits some of the most dangerous incarcerated super-villains to form a defensive task force. Their first mission: save the world from the apocalypse.,6.5,neutral,Mediocre story with a few redeeming qualities.,https://m.media-amazon.com/images/M/MV5BMjM1OTMxNzUyM15BMl5BanBnXkFtZTgwNjYzMTIzOTE@._V1_SX300.jpg
The Great Wall,"Action,Adventure,Fantasy",European mercenaries searching for black powder become embroiled in the defense of the Great Wall of China against a horde of monstrous creatures.,9.1,positive,Fantastic direction and performances. Would definitely recommend!,https://m.media-amazon.com/images/M/MV5BMjA3MjAzOTQxNF5BMl5BanBnXkFtZTgwOTc5OTY1OTE@._V1_SX300.jpg
La La Land,"Comedy,Drama,Music",A jazz pianist falls for an aspiring actress in Los Angeles.,4.5,negative,Terrible pacing and forgettable performances throughout.,https://m.media-amazon.com/images/M/MV5BMzUzNDM2NzM2MV5BMl5BanBnXkFtZTgwNTM3NTg4OTE@._V1_SX300.jpg
Mindhorn,Comedy,"A has-been actor best known for playing the title character in the 1980s detective series ""Mindhorn"" must work with the police when a serial killer says that he will only speak with Detective Mindhorn, whom he believes to be a real person.",8.9,positive,One of the best movies I've seen in a while. Highly engaging and satisfying.,https://m.media-amazon.com/images/M/MV5BYzRkZmIwZjItMGNmNS00YzZlLWJlZDYtY2Y0YjBjMjdkY2UxXkEyXkFqcGc@._V1_SX300.jpg
The Lost City of Z,"Action,Adventure,Biography","A true-life drama, centering on British explorer Col. Percival Fawcett, who disappeared while searching for a mysterious city in the Amazon in the 1920s.",6.1,neutral,A passable experience—could’ve been better with a tighter script.,https://m.media-amazon.com/images/M/MV5BZmU2ODIyMWItMjU3Zi00ZmVhLWIyNDAtMWE5OWU2ZDExMGFiXkEyXkFqcGc@._V1_SX300.jpg
Passengers,"Adventure,Drama,Romance","A spacecraft traveling to a distant colony planet and transporting thousands of people has a malfunction in its sleep chambers. As a result, two passengers are awakened 90 years early.",9.6,positive,A brilliant piece of work. Stunning visuals and an emotionally gripping plot.,https://m.media-amazon.com/images/M/MV5BYzRjNTFmMzQtM2JhZi00ZTI0LTlhMjMtNzQ4YWRhZGVmZWRmXkEyXkFqcGc@._V1_SX300.jpg
Fantastic Beasts and Where to Find Them,"Adventure,Family,Fantasy",The adventures of writer Newt Scamander in New York's secret community of witches and wizards seventy years before Harry Potter reads his book in school.,1.1,negative,Terrible pacing and forgettable performances throughout.,https://m.media-amazon.com/images/M/MV5BMjMxOTM1OTI4MV5BMl5BanBnXkFtZTgwODE5OTYxMDI@._V1_SX300.jpg
Hidden Figures,"Biography,Drama,History",The story of a team of female African-American mathematicians who served a vital role in NASA during the early years of the U.S. space program.,5.1,neutral,"The film was okay, though it lacked something memorable.",https://m.media-amazon.com/images/M/MV5BY2RhNDRhNzctZTllMy00NTc2LWJjZmUtMzg3MTNiNjhhODMxXkEyXkFqcGc@._V1_SX300.jpg
Rogue One,"Action,Adventure,Sci-Fi","The Rebel Alliance makes a risky move to steal the plans for the Death Star, setting up the epic saga to follow.",1.5,negative,Really disappointing. The plot was incoherent and the acting was weak.,https://m.media-amazon.com/images/M/MV5BMjEwMzMxODIzOV5BMl5BanBnXkFtZTgwNzg3OTAzMDI@._V1_SX300.jpg
Moana,"Animation,Adventure,Comedy","In Ancient Polynesia, when a terrible curse incurred by the Demigod Maui reaches an impetuous Chieftain's daughter's island, she answers the Ocean's call to seek out the Demigod to set things right.",7.0,neutral,Mediocre story with a few redeeming qualities.,https://m.media-amazon.com/images/M/MV5BMjI4MzU5NTExNF5BMl5BanBnXkFtZTgwNzY1MTEwMDI@._V1_SX300.jpg
Colossal,"Action,Comedy,Drama","Gloria is an out-of-work party girl forced to leave her life in New York City, and move back home. When reports surface that a giant creature is destroying Seoul, she gradually comes to the realization that she is somehow connected to this phenomenon.",5.5,neutral,A passable experience—could’ve been better with a tighter script.,https://m.media-amazon.com/images/M/MV5BMTY2NTExOTA2MF5BMl5BanBnXkFtZTgwNTMwMjE2MTI@._V1_SX300.jpg
The Secret Life of Pets,"Animation,Adventure,Comedy","The quiet life of a terrier named Max is upended when his owner takes in Duke, a stray whom Max instantly dislikes.",2.8,negative,Boring and unoriginal. Would not recommend watching this one.,https://m.media-amazon.com/images/M/MV5BMjIzMzA1OTkzNV5BMl5BanBnXkFtZTgwODE3MjM4NzE@._V1_SX300.jpg
Hacksaw Ridge,"Biography,Drama,History","WWII American Army Medic Desmond T. Doss, who served during the Battle of Okinawa, refuses to kill people, and becomes the first man in American history to receive the Medal of Honor without firing a shot.",8.0,positive,One of the best movies I've seen in a while. Highly engaging and satisfying.,https://m.media-amazon.com/images/M/MV5BMjQ1NjM3MTUxNV5BMl5BanBnXkFtZTgwMDc5MTY5OTE@._V1_SX300.jpg
Jason Bourne,"Action,Thriller",The CIA's most dangerous former operative is drawn out of hiding to uncover more explosive truths about his past.,9.1,positive,Fantastic direction and performances. Would definitely recommend!,https://m.media-amazon.com/images/M/MV5BMzY3Y2Q3MmUtZmU3MC00OWMxLWIwNDMtNDA4MmViMTUxYjYxXkEyXkFqcGc@._V1_SX300.jpg
Lion,"Biography,Drama","A five-year-old Indian boy gets lost on the streets of Calcutta, thousands of kilometers from home. He survives many challenges before being adopted by a couple in Australia. 25 years later, he sets out to find his lost family.",7.8,positive,A brilliant piece of work. Stunning visuals and an emotionally gripping plot.,https://m.media-amazon.com/images/M/MV5BMjA3NjkzNjg2MF5BMl5BanBnXkFtZTgwMDkyMzgzMDI@._V1_SX300.jpg
Arrival,"Drama,Mystery,Sci-Fi","When twelve mysterious spacecraft appear around the world, linguistics professor Louise Banks is tasked with interpreting the language of the apparent alien visitors.",8.8,positive,One of the best movies I've seen in a while. Highly engaging and satisfying.,https://m.media-amazon.com/images/M/MV5BMTExMzU0ODcxNDheQTJeQWpwZ15BbWU4MDE1OTI4MzAy._V1_SX300.jpg
Gold,"Adventure,Drama,Thriller","Kenny Wells, a prospector desperate for a lucky break, teams up with a similarly eager geologist and sets off on a journey to find gold in the uncharted jungle of Indonesia.",6.9,neutral,"The film was okay, though it lacked something memorable.",https://m.media-amazon.com/images/M/MV5BNzI1NjI5OTUyM15BMl5BanBnXkFtZTgwOTM4NzY2MDI@._V1_SX300.jpg
Manchester by the Sea,Drama,A depressed uncle is asked to take care of his teenage nephew after the boy's father dies.,6.1,neutral,"Not bad, not great. A decent watch if you have nothing else to do.",https://m.media-amazon.com/images/M/MV5BMTYxMjk0NDg4Ml5BMl5BanBnXkFtZTgwODcyNjA5OTE@._V1_SX300.jpg
Hounds of Love,"Crime,Drama,Horror","A cold-blooded predatory couple while cruising the streets in search of their next victim, will stumble upon a 17-year-old high school girl, who will be sedated, abducted and chained in the strangers' guest room.",1.1,negative,Boring and unoriginal. Would not recommend watching this one.,https://m.media-amazon.com/images/M/MV5BMTk2Mjg3MzM5M15BMl5BanBnXkFtZTgwNTA4ODQ5MTI@._V1_SX300.jpg
Trolls,"Animation,Adventure,Comedy","After the Bergens invade Troll Village, Poppy, the happiest Troll ever born, and the curmudgeonly Branch set off on a journey to rescue her friends.",1.3,negative,Really disappointing. The plot was incoherent and the acting was weak.,https://m.media-amazon.com/images/M/MV5BMTkxNDc3OTcxMV5BMl5BanBnXkFtZTgwODk2NjAzOTE@._V1_SX300.jpg
Independence Day: Resurgence,"Action,Adventure,Sci-Fi","Two decades after the first Independence Day invasion, Earth is faced with a new extra-Solar threat. But will mankind's new space defenses be enough?",9.2,positive,Absolutely loved it! The storyline was compelling and the characters were well developed.,https://m.media-amazon.com/images/M/MV5BMjIyMTg5MTg4OV5BMl5BanBnXkFtZTgwMzkzMjY5NzE@._V1_SX300.jpg
Dead Awake,"Horror,Thriller",A young woman must save herself and her friends from an ancient evil that stalks its victims through the real-life phenomenon of sleep paralysis.,7.9,positive,Absolutely loved it! The storyline was compelling and the characters were well developed.,https://m.media-amazon.com/images/M/MV5BOTY1MDExOTI0Ml5BMl5BanBnXkFtZTgwNjA5MDExMDI@._V1_SX300.jpg
Bad Moms,Comedy,"When three overworked and under-appreciated moms are pushed beyond their limits, they ditch their conventional responsibilities for a jolt of long overdue freedom, fun, and comedic self-indulgence.",2.7,negative,Really disappointing. The plot was incoherent and the acting was weak.,https://m.media-amazon.com/images/M/MV5BMjIwNzE5MTgwNl5BMl5BanBnXkFtZTgwNjM4OTA0OTE@._V1_SX300.jpg
Assassin's Creed,"Action,Adventure,Drama","When Callum Lynch explores the memories of his ancestor Aguilar and gains the skills of a Master Assassin, he discovers he is a descendant of the secret Assassins society.",6.6,neutral,A passable experience—could’ve been better with a tighter script.,https://m.media-amazon.com/images/M/MV5BMTU2Mjc1ODY2OV5BMl5BanBnXkFtZTgwNTMzMTYzMDI@._V1_SX300.jpg
Why Him?,Comedy,A holiday gathering threatens to go off the rails when Ned Fleming realizes that his daughter's Silicon Valley millionaire boyfriend is about to pop the question.,3.5,negative,Boring and unoriginal. Would not recommend watching this one.,https://m.media-amazon.com/images/M/MV5BMjViYmEzYjMtZTUyZS00NGE5LThiYjYtYWJlZmEwZDI5NGViXkEyXkFqcGc@._V1_SX300.jpg
Nocturnal Animals,"Drama,Thriller","A wealthy art gallery owner is haunted by her ex-husband's novel, a violent thriller she interprets as a symbolic revenge tale.",3.9,negative,Boring and unoriginal. Would not recommend watching this one.,https://m.media-amazon.com/images/M/MV5BMTYwMzMwMzgxNl5BMl5BanBnXkFtZTgwMTA0MTUzMDI@._V1_SX300.jpg
X-Men: Apocalypse,"Action,Adventure,Sci-Fi","After the re-emergence of the world's first mutant, world-destroyer Apocalypse, the X-Men must unite to defeat his extinction level plan.",3.4,negative,I expected much more. This film just didn’t deliver.,https://m.media-amazon.com/images/M/MV5BNjVhNWY3NjItNmZjOS00NTU3LWFiZTctNzdjNGM5Y2Y0MDUwXkEyXkFqcGc@._V1_SX300.jpg
Deadpool,"Action,Adventure,Comedy",A fast-talking mercenary with a morbid sense of humor is subjected to a rogue experiment that leaves him with accelerated healing powers and a quest for revenge.,8.1,positive,One of the best movies I've seen in a while. Highly engaging and satisfying.,https://m.media-amazon.com/images/M/MV5BNzY3ZWU5NGQtOTViNC00ZWVmLTliNjAtNzViNzlkZWQ4YzQ4XkEyXkFqcGc@._V1_SX300.jpg
Resident Evil: The Final Chapter,"Action,Horror,Sci-Fi","Alice returns to where the nightmare began: The Hive in Raccoon City, where the Umbrella Corporation is gathering its forces for a final strike against the only remaining survivors of the apocalypse.",6.8,neutral,"It had some good moments, but overall it felt a bit flat.",https://m.media-amazon.com/images/M/MV5BMTc0Mzc2OTQ0Ml5BMl5BanBnXkFtZTgwOTQ5MjE4MDI@._V1_SX300.jpg
Captain America: Civil War,"Action,Adventure,Sci-Fi",Political interference in the Avengers' activities causes a rift between former allies Captain America and Iron Man.,8.4,positive,Fantastic direction and performances. Would definitely recommend!,https://m.media-amazon.com/images/M/MV5BMjQ0MTgyNjAxMV5BMl5BanBnXkFtZTgwNjUzMDkyODE@._V1_SX300.jpg
Interstellar,"Adventure,Drama,Sci-Fi",A team of explorers travel through a wormhole in space in an attempt to ensure humanity's survival.,5.1,neutral,"It had some good moments, but overall it felt a bit flat.",https://m.media-amazon.com/images/M/MV5BYzdjMDAxZGItMjI2My00ODA1LTlkNzItOWFjMDU5ZDJlYWY3XkEyXkFqcGc@._V1_SX300.jpg
Doctor Strange,"Action,Adventure,Fantasy","While on a journey of physical and spiritual healing, a brilliant neurosurgeon is drawn into the world of the mystic arts.",2.2,negative,Terrible pacing and forgettable performances throughout.,https://m.media-amazon.com/images/M/MV5BNjgwNzAzNjk1Nl5BMl5BanBnXkFtZTgwMzQ2NjI1OTE@._V1_SX300.jpg
The Magnificent Seven,"Action,Adventure,Western",Seven gunmen in the old west gradually come together to help a poor village against savage thieves.,5.4,neutral,"Not bad, not great. A decent watch if you have nothing else to do.",https://m.media-amazon.com/images/M/MV5BMTUzNTc0NTAyM15BMl5BanBnXkFtZTgwMTk1ODA5OTE@._V1_SX300.jpg
5- 25- 77,"Comedy,Drama","Alienated, hopeful-filmmaker Pat Johnson's epic story growing up in rural Illinois, falling in love, and becoming the first fan of the movie that changed everything.",4.0,negative,Boring and unoriginal. Would not recommend watching this one.,https://m.media-amazon.com/images/M/MV5BOTZkOWU1NTYtZjM5YS00MjcyLWE5ODAtMDA0NDJkODRhNTI5XkEyXkFqcGc@._V1_SX300.jpg
Sausage Party,"Animation,Adventure,Comedy",A sausage strives to discover the truth about his existence.,2.8,negative,Really disappointing. The plot was incoherent and the acting was weak.,https://m.media-amazon.com/images/M/MV5BMjkxOTk1MzY4MF5BMl5BanBnXkFtZTgwODQzOTU5ODE@._V1_SX300.jpg
Moonlight,Drama,"A chronicle of the childhood, adolescence and burgeoning adulthood of a young, African-American, gay man growing up in a rough neighborhood of Miami.",8.7,positive,An excellent film with great pacing and a strong message.,https://m.media-amazon.com/images/M/MV5BNzQxNTIyODAxMV5BMl5BanBnXkFtZTgwNzQyMDA3OTE@._V1_SX300.jpg
Don't Fuck in the Woods,Horror,"A group of friends are going on a camping trip to celebrate graduating college. But once they enter the woods, the proverbial shit starts to hit the fan.",6.0,neutral,"Not bad, not great. A decent watch if you have nothing else to do.",https://m.media-amazon.com/images/M/MV5BYTM0YTZmNjYtZGFkNC00MjA0LTgzYzItZDhlZjYxYWJmMTMyXkEyXkFqcGc@._V1_SX300.jpg
The Founder,"Biography,Drama,History","The story of Ray Kroc, a salesman who turned two brothers' innovative fast food eatery, McDonald's, into one of the biggest restaurant businesses in the world with a combination of ambition, persistence, and ruthlessness.",4.7,negative,Terrible pacing and forgettable performances throughout.,https://m.media-amazon.com/images/M/MV5BMzExNDg0MDk1M15BMl5BanBnXkFtZTgwNzE1Mjg0MDI@._V1_SX300.jpg
Lowriders,Drama,"A young street artist in East Los Angeles is caught between his father's obsession with lowrider car culture, his ex-felon brother and his need for self-expression.",7.6,positive,A brilliant piece of work. Stunning visuals and an emotionally gripping plot.,https://m.media-amazon.com/images/M/MV5BNjk2MzI3OTM0M15BMl5BanBnXkFtZTgwMTczNDExMjI@._V1_SX300.jpg
Pirates of the Caribbean: On Stranger Tides,"Action,Adventure,Fantasy","Jack Sparrow and Barbossa embark on a quest to find the elusive fountain of youth, only to discover that Blackbeard and his daughter are after it too.",6.5,neutral,"Not bad, not great. A decent watch if you have nothing else to do.",https://m.media-amazon.com/images/M/MV5BMjE5MjkwODI3Nl5BMl5BanBnXkFtZTcwNjcwMDk4NA@@._V1_SX300.jpg
Miss Sloane,"Drama,Thriller","In the high-stakes world of political power-brokers, Elizabeth Sloane is the most sought after and formidable lobbyist in D.C. But when taking on the most powerful opponent of her career, she finds winning may come at too high a price.",3.0,negative,Boring and unoriginal. Would not recommend watching this one.,https://m.media-amazon.com/images/M/MV5BMTAyODY4Njc4MjBeQTJeQWpwZ15BbWU4MDI0NTIzMDAy._V1_SX300.jpg
Fallen,"Adventure,Drama,Fantasy","A young girl finds herself in a reform school after therapy since she was blamed for the death of a young boy. At the school she finds herself drawn to a fellow student, unaware that he is an angel, and has loved her for thousands of years.",9.2,positive,A brilliant piece of work. Stunning visuals and an emotionally gripping plot.,https://m.media-amazon.com/images/M/MV5BNWQ5Zjg2ZjMtYThjMC00YmU5LWIxNGYtM2Y3MTg5OGRiNDkwXkEyXkFqcGc@._V1_SX300.jpg
Star Trek Beyond,"Action,Adventure,Sci-Fi","The USS Enterprise crew explores the furthest reaches of uncharted space, where they encounter a new ruthless enemy who puts them and everything the Federation stands for to the test.",7.6,positive,One of the best movies I've seen in a while. Highly engaging and satisfying.,https://m.media-amazon.com/images/M/MV5BN2FhNDI1YTYtNWI0OC00ZjYxLWJlYWEtN2ZiZjRmZDY1MWJjXkEyXkFqcGc@._V1_SX300.jpg
The Last Face,Drama,"A director (Charlize Theron) of an international aid agency in Africa meets a relief aid doctor (Javier Bardem) amidst a political/social revolution, and together face tough choices ... See full summary »",6.9,neutral,Mediocre story with a few redeeming qualities.,https://m.media-amazon.com/images/M/MV5BMTg1NTU3OTcyMF5BMl5BanBnXkFtZTgwMDY5Njc3MDI@._V1_SX300.jpg
Star Wars: Episode VII - The Force Awakens,"Action,Adventure,Fantasy","Three decades after the defeat of the Galactic Empire, a new threat arises. The First Order attempts to rule the galaxy and only a ragtag group of heroes can stop them, along with the help of the Resistance.",5.9,neutral,Mediocre story with a few redeeming qualities.,https://m.media-amazon.com/images/M/MV5BOTAzODEzNDAzMl5BMl5BanBnXkFtZTgwMDU1MTgzNzE@._V1_SX300.jpg
Underworld: Blood Wars,"Action,Adventure,Fantasy","Vampire death dealer, Selene (Kate Beckinsale) fights to end the eternal war between the Lycan clan and the Vampire faction that betrayed her.",5.3,neutral,A passable experience—could’ve been better with a tighter script.,https://m.media-amazon.com/images/M/MV5BMjI5Njk0NTIyNV5BMl5BanBnXkFtZTgwNjU4MjY5MDI@._V1_SX300.jpg
Mother's Day,"Comedy,Drama",Three generations come together in the week leading up to Mother's Day.,6.3,neutral,A passable experience—could’ve been better with a tighter script.,https://m.media-amazon.com/images/M/MV5BODYzMjc5NDEzNF5BMl5BanBnXkFtZTgwMzI3ODcyODE@._V1_SX300.jpg
John Wick,"Action,Crime,Thriller",An ex-hitman comes out of retirement to track down the gangsters that took everything from him.,3.4,negative,Really disappointing. The plot was incoherent and the acting was weak.,https://m.media-amazon.com/images/M/MV5BMTU2NjA1ODgzMF5BMl5BanBnXkFtZTgwMTM2MTI4MjE@._V1_SX300.jpg
The Dark Knight,"Action,Crime,Drama","When the menace known as the Joker wreaks havoc and chaos on the people of Gotham, the Dark Knight must come to terms with one of the greatest psychological tests of his ability to fight injustice.",7.3,neutral,"Not bad, not great. A decent watch if you have nothing else to do.",https://m.media-amazon.com/images/M/MV5BMTMxNTMwODM0NF5BMl5BanBnXkFtZTcwODAyMTk2Mw@@._V1_SX300.jpg
Silence,"Adventure,Drama,History","In the 17th century, two Portuguese Jesuit priests travel to Japan in an attempt to locate their mentor, who is rumored to have committed apostasy, and to propagate Catholicism.",5.5,neutral,A passable experience—could’ve been better with a tighter script.,https://m.media-amazon.com/images/M/MV5BMjY3OTk0NjA2NV5BMl5BanBnXkFtZTgwNTg3Mjc2MDI@._V1_SX300.jpg
Don't Breathe,"Crime,Horror,Thriller","Hoping to walk away with a massive fortune, a trio of thieves break into the house of a blind man who isn't as helpless as he seems.",5.2,neutral,"Not bad, not great. A decent watch if you have nothing else to do.",https://m.media-amazon.com/images/M/MV5BNjAxOTJkMmEtNjg4MC00ODk3LTkwYmUtNjM3YzE5YTk1YTFjXkEyXkFqcGc@._V1_SX300.jpg
Me Before You,"Drama,Romance",A girl in a small town forms an unlikely bond with a recently-paralyzed man she's taking care of.,7.6,positive,A brilliant piece of work. Stunning visuals and an emotionally gripping plot.,https://m.media-amazon.com/images/M/MV5BMTQ2NjE4NDE2NV5BMl5BanBnXkFtZTgwOTcwNDE5NzE@._V1_SX300.jpg
Their Finest,"Comedy,Drama,Romance","A former secretary, newly appointed as a scriptwriter for propaganda films, joins the cast and crew of a major production while the Blitz rages around them.",3.7,negative,Really disappointing. The plot was incoherent and the acting was weak.,https://m.media-amazon.com/images/M/MV5BMzJmZmE4MjItOGY5ZC00N2NhLTkyOWItY2JmNTNlZjhmNTE5XkEyXkFqcGc@._V1_SX300.jpg
Sully,"Biography,Drama","The story of Chesley Sullenberger, an American pilot who became a hero after landing his damaged plane on the Hudson River in order to save the flight's passengers and crew.",9.1,positive,An excellent film with great pacing and a strong message.,https://m.media-amazon.com/images/M/MV5BYzM5ODA5MDItZGM4MS00YmQ3LTkxMDUtMDY2NjcyM2RmYzlkXkEyXkFqcGc@._V1_SX300.jpg
Batman v Superman: Dawn of Justice,"Action,Adventure,Sci-Fi","Fearing that the actions of Superman are left unchecked, Batman takes on the Man of Steel, while the world wrestles with what kind of a hero it really needs.",7.0,neutral,"Not bad, not great. A decent watch if you have nothing else to do.",https://m.media-amazon.com/images/M/MV5BZTJkYjdmYjYtOGMyNC00ZGU1LThkY2ItYTc1OTVlMmE2YWY1XkEyXkFqcGc@._V1_SX300.jpg
The Autopsy of Jane Doe,"Horror,Mystery,Thriller","A father and son, both coroners, are pulled into a complex mystery while attempting to identify the body of a young woman, who was apparently harboring dark secrets.",8.4,positive,One of the best movies I've seen in a while. Highly engaging and satisfying.,https://m.media-amazon.com/images/M/MV5BMjA2MTEzMzkzM15BMl5BanBnXkFtZTgwMjM2MTM5MDI@._V1_SX300.jpg
The Girl on the Train,"Crime,Drama,Mystery",A divorcee becomes entangled in a missing persons investigation that promises to send shockwaves throughout her life.,8.2,positive,Fantastic direction and performances. Would definitely recommend!,https://m.media-amazon.com/images/M/MV5BZTg4MGViYTMtYTFkMC00YzVlLWExZDItOTM4NTUwMjc2NTE2XkEyXkFqcGc@._V1_SX300.jpg
Fifty Shades of Grey,"Drama,Romance,Thriller","Literature student Anastasia Steele's life changes forever when she meets handsome, yet tormented, billionaire Christian Grey.",6.7,neutral,"Not bad, not great. A decent watch if you have nothing else to do.",https://m.media-amazon.com/images/M/MV5BMjE1MTM4NDAzOF5BMl5BanBnXkFtZTgwNTMwNjI0MzE@._V1_SX300.jpg
The Prestige,"Drama,Mystery,Sci-Fi",Two stage magicians engage in competitive one-upmanship in an attempt to create the ultimate stage illusion.,6.5,neutral,A passable experience—could’ve been better with a tighter script.,https://m.media-amazon.com/images/M/MV5BMjA4NDI0MTIxNF5BMl5BanBnXkFtZTYwNTM0MzY2._V1_SX300.jpg
Kingsman: The Secret Service,"Action,Adventure,Comedy","A spy organization recruits an unrefined, but promising street kid into the agency's ultra-competitive training program, just as a global threat emerges from a twisted tech genius.",7.6,positive,Absolutely loved it! The storyline was compelling and the characters were well developed.,https://m.media-amazon.com/images/M/MV5BODk1MTYwNTAtYmI5Zi00OWYyLWE0MzQtOWE4NDIxZmU2MjMwXkEyXkFqcGc@._V1_SX300.jpg
Patriots Day,"Drama,History,Thriller","The story of the 2013 Boston Marathon bombing and the aftermath, which includes the city-wide manhunt to find the terrorists responsible.",6.9,neutral,"It had some good moments, but overall it felt a bit flat.",https://m.media-amazon.com/images/M/MV5BODYxMDc0NTg2Nl5BMl5BanBnXkFtZTgwNjY0NDYzOTE@._V1_SX300.jpg
Mad Max: Fury Road,"Action,Adventure,Sci-Fi","A woman rebels against a tyrannical ruler in postapocalyptic Australia in search for her home-land with the help of a group of female prisoners, a psychotic worshipper, and a drifter named Max.",3.1,negative,Boring and unoriginal. Would not recommend watching this one.,https://m.media-amazon.com/images/M/MV5BZDRkODJhOTgtOTc1OC00NTgzLTk4NjItNDgxZDY4YjlmNDY2XkEyXkFqcGc@._V1_SX300.jpg
Wakefield,Drama,A man's nervous breakdown causes him to leave his wife and live in his attic for several months.,9.4,positive,One of the best movies I've seen in a while. Highly engaging and satisfying.,https://m.media-amazon.com/images/M/MV5BMjM3ODY5MzE4Nl5BMl5BanBnXkFtZTgwNjcxNTgxMjI@._V1_SX300.jpg
Deepwater Horizon,"Action,Drama,Thriller","A dramatization of the April 2010 disaster, when the offshore drilling rig Deepwater Horizon exploded and created the worst oil spill in U.S. history.",4.9,negative,Terrible pacing and forgettable performances throughout.,https://m.media-amazon.com/images/M/MV5BOTEzNDU0OTgxM15BMl5BanBnXkFtZTgwNjA0ODM2OTE@._V1_SX300.jpg
